{
  "$schema": "https://json-schema.org/draft/2020-12/schema",
  "$id": "https://daily-puzzles.invalid/schema/puzzle.schema.json",
  "title": "Daily puzzle",
  "description": "Single source of truth for the file format shared by the Python engine and the TypeScript app. Structural validation only; size- and region-dependent invariants are enforced in code by both languages.",
  "type": "object",
  "additionalProperties": false,
  "required": ["id", "type", "seed", "generatorVersion", "board"],
  "properties": {
    "id": {
      "description": "Puzzle date in UTC, YYYY-MM-DD, with an optional family suffix for a companion puzzle of that day. Also the filename stem. The suffix list is generated from `conformance/id-cases/manifest.json`, which also pins the engine's `Rulebook.id_suffix` and the app's `PUZZLE_TYPE_SUFFIX` to it. Escapes are kept to what both regex flavours accept: ajv compiles patterns with the `u` flag, which rejects a hyphen escaped the Python way.",
      "type": "string",
      "pattern": "^[0-9]{4}-[0-9]{2}-[0-9]{2}(-tracks-medium|-tracks-small|-tracks-large|-tracks|-words|-star)?$"
    },
    "type": {
      "description": "Puzzle family. Selects the adapter in the app.",
      "enum": ["queens", "star-battle", "train-tracks", "word-paths"]
    },
    "seed": {
      "description": "Seed for the deterministic PRNG, so any puzzle can be replayed exactly.",
      "type": "integer",
      "minimum": 0,
      "maximum": 4294967295
    },
    "generatorVersion": {
      "description": "Bumped when generation changes in a way that would alter output for a fixed seed. Capped at the JavaScript safe-integer limit: JSON.parse rounds larger values, so the browser would disagree with the engine about which algorithm produced the puzzle.",
      "type": "integer",
      "minimum": 1,
      "maximum": 9007199254740991
    },
    "difficulty": {
      "description": "Band the board was generated to, 1-based into the engine's LEVEL_NAMES: 1 Easy, 2 Medium, 3 Hard, 4 Expert, 5 Nightmare. The weekly ramp aims each weekday at one band and may fall below it when the seed budget runs out, so this is a floor rather than a promise. Absent from files published before the ramp existed.",
      "type": "integer",
      "minimum": 1,
      "maximum": 5
    },
    "board": {
      "description": "The grid and everything that describes it, nested so the shape belongs to the game rather than the envelope. `size` sat at the top level until this migration, where it meant 'size x size' for one genre and would mean 'size wide' for another; nesting it is what stops a third game inheriting that ambiguity. Which shape applies is chosen by the sibling `type` in the top-level `allOf` below, because `type` is not a member of `board` and so cannot pick a variant from inside.",
      "type": "object"
    }
  },
  "allOf": [
    {
      "if": {
        "properties": { "type": { "enum": ["queens", "star-battle"] } },
        "required": ["type"]
      },
      "then": {
        "properties": {
          "board": {
            "description": "The marks board: a square grid divided into regions, one or more marks to place per region. `size` means size x size here and nothing else, which is why Train Tracks states its own dimensions rather than reusing it.",
            "type": "object",
            "additionalProperties": false,
            "required": ["size", "regions"],
            "properties": {
              "size": {
                "description": "Grid is size x size, and the number of regions equals size.",
                "type": "integer",
                "minimum": 2,
                "maximum": 16
              },
              "regions": {
                "description": "Region id per cell, row-major, length exactly size * size.",
                "type": "array",
                "items": { "type": "integer", "minimum": 0, "maximum": 15 }
              },
              "regionCapacity": {
                "description": "Queens per region, per region id. Defaults to 1 for every region (the Queens case). Required for star-battle.",
                "type": "array",
                "items": { "type": "integer", "minimum": 1, "maximum": 16 }
              }
            }
          }
        }
      }
    },
    {
      "if": { "properties": { "type": { "const": "star-battle" } }, "required": ["type"] },
      "then": {
        "properties": {
          "board": {
            "type": "object",
            "required": ["regionCapacity"],
            "properties": { "regionCapacity": { "type": "array", "minItems": 1 } }
          }
        }
      }
    },
    {
      "if": { "properties": { "type": { "const": "train-tracks" } }, "required": ["type"] },
      "then": {
        "properties": {
          "board": {
            "description": "The track grid: a rectangular grid of pieces joined into one line. No regions and no single `size`, which is the whole reason it is a variant rather than another member of the marks shape.",
            "type": "object",
            "additionalProperties": false,
            "required": ["width", "height", "rowClues", "colClues", "givens"],
            "properties": {
              "width": {
                "description": "Columns in the grid.",
                "type": "integer",
                "minimum": 2,
                "maximum": 16
              },
              "height": {
                "description": "Rows in the grid.",
                "type": "integer",
                "minimum": 2,
                "maximum": 16
              },
              "rowClues": {
                "description": "Cells the line occupies in each row, length exactly height. Zero is legal: the line may skip a row entirely. Summed across rows and columns alike, because one line cannot disagree with itself.",
                "type": "array",
                "items": { "type": "integer", "minimum": 0 }
              },
              "colClues": {
                "description": "Cells the line occupies in each column, length exactly width. Zero is legal for the same reason a row's zero is.",
                "type": "array",
                "items": { "type": "integer", "minimum": 0 }
              },
              "givens": {
                "description": "Piece number per cell, row-major, length exactly width * height. 0 is an empty cell, and 1 to 6 are the six pieces: two straights and four turns. Exactly two givens face off the edge, because the line has two ends.",
                "type": "array",
                "items": { "type": "integer", "minimum": 0, "maximum": 6 }
              }
            }
          }
        }
      }
    },
    {
      "if": { "properties": { "type": { "const": "word-paths" } }, "required": ["type"] },
      "then": {
        "not": { "properties": { "difficulty": {} }, "required": ["difficulty"] },
        "properties": {
          "generatorVersion": { "const": 1 },
          "board": {
            "type": "object",
            "additionalProperties": false,
            "required": ["width", "height", "letters", "wordLengths"],
            "properties": {
              "width": { "type": "integer", "minimum": 1, "maximum": 7 },
              "height": { "type": "integer", "minimum": 1, "maximum": 7 },
              "letters": {
                "description": "Row-major A-Z letters, null for a blocker; length exactly width * height.",
                "type": "array", "maxItems": 49,
                "items": { "type": ["string", "null"], "minLength": 1, "maxLength": 1, "pattern": "^[A-Z]$" }
              },
              "wordLengths": {
                "type": "array", "minItems": 1, "maxItems": 4, "uniqueItems": true,
                "items": { "type": "integer", "minimum": 3, "maximum": 6 }
              }
            }
          }
        }
      }
    }
  ]
}
