{
  "id": "2026-10-22-star",
  "type": "star-battle",
  "seed": 337113698,
  "generatorVersion": 2,
  "board": {"size": 9, "regions": [0, 0, 0, 0, 0, 1, 1, 1, 1, 2, 2, 2, 0, 3, 1, 1, 1, 1, 2, 2, 2, 0, 3, 3, 1, 1, 1, 2, 4, 4, 4, 3, 3, 3, 3, 3, 2, 4, 4, 4, 6, 6, 3, 3, 3, 4, 4, 4, 4, 6, 6, 5, 5, 5, 4, 6, 6, 6, 6, 6, 7, 5, 5, 4, 6, 8, 8, 8, 7, 7, 7, 7, 6, 6, 8, 8, 8, 7, 7, 7, 7], "regionCapacity": [2, 2, 2, 2, 2, 2, 2, 2, 2]}
}
