{
  "id": "2026-10-22-words",
  "type": "word-paths",
  "seed": 4294967294,
  "generatorVersion": 1,
  "board": {"width": 5, "height": 5, "letters": ["S", "C", "A", "M", "P", "E", "Y", null, null, "T", "H", "T", null, null, "H", "G", "W", null, null, "A", "I", "E", null, "K", "N"], "wordLengths": [3, 4, 5, 6]}
}
