{
  "id": "2026-10-20-words",
  "type": "word-paths",
  "seed": 65535,
  "generatorVersion": 1,
  "board": {"width": 5, "height": 5, "letters": [null, "M", "I", "L", "C", null, "B", null, null, "R", null, "C", "A", null, "E", "E", null, "L", "L", "T", "N", "O", "M", "E", "T"], "wordLengths": [3, 4, 5, 6]}
}
