{
  "id": "2026-10-06-words",
  "type": "word-paths",
  "seed": 3537235835,
  "generatorVersion": 3,
  "board": {"width": 6, "height": 6, "letters": ["P", "F", "E", "L", "E", "R", "A", null, null, "L", "G", null, "G", "E", "D", "O", "I", "G", null, null, "I", "W", "T", "O", null, null, "V", "O", null, "A", null, null, null, "R", "P", "T"], "wordLengths": [3, 4, 5, 6, 7]}
}
