{
  "id": "2026-10-27",
  "type": "queens",
  "seed": 1955716406,
  "generatorVersion": 1,
  "board": {"size": 8, "regions": [0, 1, 1, 1, 1, 2, 2, 2, 4, 4, 4, 4, 1, 2, 2, 2, 4, 4, 4, 4, 4, 2, 2, 2, 4, 4, 4, 4, 4, 3, 5, 5, 4, 4, 4, 4, 4, 5, 5, 5, 4, 4, 4, 4, 7, 5, 5, 5, 6, 6, 6, 4, 7, 7, 7, 5, 6, 6, 6, 7, 7, 7, 7, 5]},
  "difficulty": 2
}
