{
  "id": "2026-09-28-words",
  "type": "word-paths",
  "seed": 1652572808,
  "generatorVersion": 3,
  "board": {"width": 6, "height": 6, "letters": ["U", "R", null, null, null, null, "P", "P", "O", null, null, null, "E", "L", "S", "E", "S", null, "N", "I", null, null, "I", "L", "O", "B", "T", "A", "H", "V", "A", "R", "D", null, "R", "E"], "wordLengths": [3, 4, 5, 6, 7]}
}
