{
  "id": "2026-10-09-words",
  "type": "word-paths",
  "seed": 3993614302,
  "generatorVersion": 3,
  "board": {"width": 6, "height": 6, "letters": [null, null, null, null, null, "M", null, null, null, null, null, "I", "F", "E", "I", "P", "T", "N", "I", "C", "T", "V", "I", "R", "N", "O", "I", "E", "A", "R", "S", "T", "E", "E", "L", null], "wordLengths": [3, 4, 5, 6, 7]}
}
