{
  "id": "2026-11-03-words",
  "type": "word-paths",
  "seed": 3551099687,
  "generatorVersion": 3,
  "board": {"width": 6, "height": 6, "letters": ["E", "R", "U", "T", "C", "I", "E", null, null, "O", "F", "P", "I", null, null, "O", null, null, "T", "H", "E", "R", "A", "H", null, "J", "R", "R", "I", "C", null, "A", "M", null, null, null], "wordLengths": [3, 4, 5, 6, 7]}
}
