{
  "id": "2026-10-19-words",
  "type": "word-paths",
  "seed": 255,
  "generatorVersion": 1,
  "board": {"width": 5, "height": 5, "letters": ["S", "I", "G", "L", null, "P", "E", "N", "A", null, "F", "E", "H", "S", null, "U", "N", "K", "E", null, null, "L", "A", null, null], "wordLengths": [3, 4, 5, 6]}
}
