{
  "id": "2026-10-18-words",
  "type": "word-paths",
  "seed": 247117196,
  "generatorVersion": 2,
  "board": {"width": 5, "height": 5, "letters": [null, "R", "I", "C", null, null, "B", null, "J", "T", "F", "A", null, "O", "S", "R", "H", "C", "Y", "U", "I", "A", null, null, "D"], "wordLengths": [3, 4, 5, 6]}
}
