{
  "id": "2026-10-07-words",
  "type": "word-paths",
  "seed": 995210358,
  "generatorVersion": 3,
  "board": {"width": 6, "height": 6, "letters": ["E", "L", "P", "E", "R", null, "H", "E", "T", "O", null, null, "T", "S", "R", "R", "P", null, "D", "A", "O", null, "T", null, "F", "L", "O", "O", "E", null, null, null, null, "R", "Y", null], "wordLengths": [3, 4, 5, 6, 7]}
}
